SINTA_ID,Author_Name,University,Department,Subjects,SINTA_Score_Overall,SINTA_Score_3Yr,Affil_Score,Affil_Score_3Yr,Scopus,GScholar,WOS
"6172418,AVIV YUNIAR RAHMAN,Universitas Widya Gama,S1 - Teknik Informatika,""Image Processing, Computer Vision, Deep Learning, Natural Language Processing"",1.438,810,0,0,32,92,6.0"
"161208,FITRI MARISA,Universitas Widya Gama,S1 - Teknik Informatika,""Computer Support learning, data mining"",2.173,787,0,0,17,175,9.0"
"259792,SYAHRONI WAHYU IRIANANDA,Universitas Widya Gama,S1 - Teknik Informatika,""Artificial Intelligent, Text Mining, Decision Support System, Data Science"",296,196,0,0,0,26,0.0"
"6729051,RANGGA PAHLEVI PUTRA,Universitas Widya Gama,S1 - Teknik Informatika,""Image Processing, Biometric System, Digital Marketing, Informatics"",164,130,0,0,0,20,0.0"
6127886,FIRMAN NURDIYANSYAH,Universitas Widya Gama,S1 - Bisnis Digital,,120,43,0,0,0,26,0.0
