Title,Link,Publisher,Journal,Author Order,Authors,Year,DOI,Quartile,Researcher Name,Researcher ID,Affiliation,Department
Penggunaan Tepung Daun Pepaya (Carica papaya) dalam Ransum Ayam Arab Terhadap Produktivitas dan Anticacing,https://scholar.google.com/scholar?q=+intitle:%27Penggunaan%20Tepung%20Daun%20Pepaya%20(Carica%20papaya)%20dalam%20Ransum%20Ayam%20Arab%20Terhadap%20Produktivitas%20dan%20Anticacing%27,"Fakultas Peternakan Undip, Semarang (Tesis Program Pascasarjana), 2007","Fakultas Peternakan Undip, Semarang (Tesis Program Pascasarjana), 2007",N/A,Authors : D Hermawan,2007,N/A,N/A,DADANG HERMAWAN,5987236,Universitas Widya Gama,S1 - Teknik Mesin
EVALUATION OF GRADUATES COMPETENCE ON LEVEL OF THEIR LOYALTY TOWARDS THE UNIVERSITY (Study on STIKOM Bali Students Graduate),https://scholar.google.com/scholar?q=+intitle:%27EVALUATION%20OF%20GRADUATES%20COMPETENCE%20ON%20LEVEL%20OF%20THEIR%20LOYALTY%20TOWARDS%20THE%20UNIVERSITY%20(Study%20on%20STIKOM%20Bali%20Students%20Graduate)%27,,,N/A,Authors : D Hermawan,1989,N/A,N/A,DADANG HERMAWAN,5987236,Universitas Widya Gama,S1 - Teknik Mesin
THE IMPLEMENTATION OF ANTHROPOMETRIC MEASUREMENT IN DESIGNING THE ERGONOMICS WORK FURNITURE,https://scholar.google.com/scholar?q=+intitle:%27THE%20IMPLEMENTATION%20OF%20ANTHROPOMETRIC%20MEASUREMENT%20IN%20DESIGNING%20THE%20ERGONOMICS%20WORK%20FURNITURE%27,,,N/A,"Authors : A Hardianto, D Hermawan",0000,N/A,N/A,DADANG HERMAWAN,5987236,Universitas Widya Gama,S1 - Teknik Mesin
JOURNAL OF SCIENCE AND APPLIED ENGINEERING (JSAE) E ISSN: 2621-3753 P ISSN: 2621-3745 Vol. 1 No. 1 2018,https://scholar.google.com/scholar?q=+intitle:%27JOURNAL%20OF%20SCIENCE%20AND%20APPLIED%20ENGINEERING%20(JSAE)%20E%20ISSN:%202621-3753%20P%20ISSN:%202621-3745%20Vol.%201%20No.%201%202018%27,,,N/A,"Authors : F Rahmadianto, D Hermawan",0000,N/A,N/A,DADANG HERMAWAN,5987236,Universitas Widya Gama,S1 - Teknik Mesin
Designing the Ergonomic Press and Molding Machine of Cassava Chips for Sustainable Development in SMEs,https://scholar.google.com/scholar?q=+intitle:%27Designing%20the%20Ergonomic%20Press%20and%20Molding%20Machine%20of%20Cassava%20Chips%20for%20Sustainable%20Development%20in%20SMEs%27,,,N/A,"Authors : AH Silviana, N Fuhaid, D Hermawan",0000,N/A,N/A,DADANG HERMAWAN,5987236,Universitas Widya Gama,S1 - Teknik Mesin
Corporate Governance Mechanism: Its Role Against the Criteria for Sharia Stocks and Share Prices,https://scholar.google.com/scholar?q=+intitle:%27Corporate%20Governance%20Mechanism:%20Its%20Role%20Against%20the%20Criteria%20for%20Sharia%20Stocks%20and%20Share%20Prices%27,"Review of Islamic Economics and Finance (RIEF) 5 (1), 38-51, 0","Review of Islamic Economics and Finance (RIEF) 5 (1), 38-51, 0",N/A,"Authors : ME Syarief, D Hermawan, LN Pratiwi",0000,N/A,N/A,DADANG HERMAWAN,5987236,Universitas Widya Gama,S1 - Teknik Mesin
"PENGARUH BED OCCUPATION RATE, TURN OVER INTERVAL, AVERAGE LENGHT OF STAY DAN BED TURN OVER TERHADAPKINERJA PROFITABILITAS, DENGAN KINERJA PENDAPATAN SEBAGAI VARIABEL …","https://scholar.google.com/scholar?q=+intitle:%27PENGARUH%20BED%20OCCUPATION%20RATE,%20TURN%20OVER%20INTERVAL,%20AVERAGE%20LENGHT%20OF%20STAY%20DAN%20BED%20TURN%20OVER%20TERHADAPKINERJA%20PROFITABILITAS,%20DENGAN%20KINERJA%20PENDAPATAN%20SEBAGAI%20VARIABEL%C2%A0%E2%80%A6%27",,,N/A,Authors : D Hermawan,0000,N/A,N/A,DADANG HERMAWAN,5987236,Universitas Widya Gama,S1 - Teknik Mesin
PENGEMBANGAN SISTEM PENGGERAK LOADING-UNLOADING TARGET (PROTOTIPE) DI FASILITAS IRADIASI RSG–GAS,https://scholar.google.com/scholar?q=+intitle:%27PENGEMBANGAN%20SISTEM%20PENGGERAK%20LOADING-UNLOADING%20TARGET%20(PROTOTIPE)%20DI%20FASILITAS%20IRADIASI%20RSG%E2%80%93GAS%27,,,N/A,"Authors : U Sidabutar, RM Sunarko, D Hermawan",0000,N/A,N/A,DADANG HERMAWAN,5987236,Universitas Widya Gama,S1 - Teknik Mesin
JOURNAL OF SCIENCE AND APPLIED ENGINEERING (JSAE) E ISSN: 2621-3753 P ISSN: 2621-3745 Vol. 1 No. 1 2018,https://scholar.google.com/scholar?q=+intitle:%27JOURNAL%20OF%20SCIENCE%20AND%20APPLIED%20ENGINEERING%20(JSAE)%20E%20ISSN:%202621-3753%20P%20ISSN:%202621-3745%20Vol.%201%20No.%201%202018%27,,,N/A,"Authors : F Rahmadianto, D Hermawan",0000,N/A,N/A,DADANG HERMAWAN,5987236,Universitas Widya Gama,S1 - Teknik Mesin
