Title,Link,Publisher,Journal,Author Order,Authors,Year,DOI,Quartile,Researcher Name,Researcher ID,Affiliation,Department
The impact of Penta-Helix Collaborative Business Incubation Process on the creative business strategic orientation and innovation capability,https://www.scopus.com/record/display.uri?eid=2-s2.0-85183943929&origin=resultslist,International Journal of Learning and Intellectual Capital,International Journal of Learning and Intellectual Capital,Author Order : 4 of 5,N/A,2024,N/A,Q2 as Journal,ADYA HERMAWATI,5977530,Universitas Widya Gama,S2 - Manajemen
"Reconstruction of Spiritual Marketing, Culture of Innovation, Quality of Work Life, and Retainers for Tourism Industry SMEs in East Java",https://www.scopus.com/record/display.uri?eid=2-s2.0-85144702538&origin=resultslist,Administrative Sciences,Administrative Sciences,Author Order : 4 of 5,N/A,2022,N/A,Q2 as Journal,ADYA HERMAWATI,5977530,Universitas Widya Gama,S2 - Manajemen
MARKETING STRATEGY WITH PATH ANALYSIS IN INCREASING COMPETITIVE ADVANTAGE IN TOURISM INDUSTRY SMES IN EAST JAVA,https://www.scopus.com/record/display.uri?eid=2-s2.0-85141280989&origin=resultslist,Journal of Theoretical and Applied Information Technology,Journal of Theoretical and Applied Information Technology,Author Order : 4 of 5,N/A,2022,N/A,Q4 as Journal,ADYA HERMAWATI,5977530,Universitas Widya Gama,S2 - Manajemen
The implementation of dynamic capabilities for small and medium-sized enterprises in creating innovation,https://www.scopus.com/record/display.uri?eid=2-s2.0-85081241033&origin=resultslist,VINE Journal of Information and Knowledge Management Systems,VINE Journal of Information and Knowledge Management Systems,Author Order : 4 of 5,N/A,2021,N/A,Q1 as Journal,ADYA HERMAWATI,5977530,Universitas Widya Gama,S2 - Manajemen
The influence of quality of work-life and compensation on employee performance through organizational culture (study of agricultural extension in Pasuruan Regency),https://www.scopus.com/record/display.uri?eid=2-s2.0-85111487390&origin=resultslist,Academy of Strategic Management Journal,Academy of Strategic Management Journal,Author Order : 4 of 5,N/A,2021,N/A,no-Q as Journal,ADYA HERMAWATI,5977530,Universitas Widya Gama,S2 - Manajemen
Freelancers Intentions Towards Adoption Of Islamic Banking,https://www.scopus.com/record/display.uri?eid=2-s2.0-85104261973&origin=resultslist,Academy of Strategic Management Journal,Academy of Strategic Management Journal,Author Order : 4 of 5,N/A,2021,N/A,no-Q as Journal,ADYA HERMAWATI,5977530,Universitas Widya Gama,S2 - Manajemen
"Satisfaction, hr, and open innovation in tourism sector",https://www.scopus.com/record/display.uri?eid=2-s2.0-85098524646&origin=resultslist,"Journal of Open Innovation: Technology, Market, and Complexity","Journal of Open Innovation: Technology, Market, and Complexity",Author Order : 4 of 5,N/A,2020,N/A,Q1 as Journal,ADYA HERMAWATI,5977530,Universitas Widya Gama,S2 - Manajemen
Unsupervised Data Mining with K-Medoids Method in Mapping Areas of Student and Teacher Ratio in Indonesia,https://www.scopus.com/record/display.uri?eid=2-s2.0-85098103315&origin=resultslist,TEM Journal,TEM Journal,Author Order : 4 of 5,N/A,2020,N/A,Q3 as Journal,ADYA HERMAWATI,5977530,Universitas Widya Gama,S2 - Manajemen
Determining strategy to improve human resources performance by identifying tourism condition SMEs,https://www.scopus.com/record/display.uri?eid=2-s2.0-85097294567&origin=resultslist,Academic Journal of Interdisciplinary Studies,Academic Journal of Interdisciplinary Studies,Author Order : 4 of 5,N/A,2020,N/A,Q3 as Journal,ADYA HERMAWATI,5977530,Universitas Widya Gama,S2 - Manajemen
Supply chain practices of small and medium enterprises as a maximized effort of human resource performance strategy in tourism sector,https://www.scopus.com/record/display.uri?eid=2-s2.0-85087776774&origin=resultslist,International Journal of Supply Chain Management,International Journal of Supply Chain Management,Author Order : 4 of 5,N/A,2020,N/A,no-Q as Journal,ADYA HERMAWATI,5977530,Universitas Widya Gama,S2 - Manajemen
Transglobal leadership approach to sustainable tourism competitiveness at tourism sector-engaged MSMEs through integrated human resource performance and responsible marketing,https://www.scopus.com/record/display.uri?eid=2-s2.0-85085910318&origin=resultslist,International Journal of Tourism Cities,International Journal of Tourism Cities,Author Order : 1 of 1,N/A,2020,N/A,Q2 as Journal,ADYA HERMAWATI,5977530,Universitas Widya Gama,S2 - Manajemen
"Swot analysis utilization in designing performance development strategy for micro, small & medium enterprises in Malang area coordinator",https://www.scopus.com/record/display.uri?eid=2-s2.0-85083436827&origin=resultslist,International Journal of Psychosocial Rehabilitation,International Journal of Psychosocial Rehabilitation,Author Order : 1 of 1,N/A,2020,N/A,no-Q as Journal,ADYA HERMAWATI,5977530,Universitas Widya Gama,S2 - Manajemen
The implementation of dynamic capabilities for SMEs in creating innovation,https://www.scopus.com/record/display.uri?eid=2-s2.0-85081359381&origin=resultslist,Journal of Workplace Learning,Journal of Workplace Learning,Author Order : 1 of 1,N/A,2020,N/A,Q2 as Journal,ADYA HERMAWATI,5977530,Universitas Widya Gama,S2 - Manajemen
Identify strategies for cooperatives in East Java with analytic hierarchical process,https://www.scopus.com/record/display.uri?eid=2-s2.0-85082179778&origin=resultslist,International Journal of Development Issues,International Journal of Development Issues,Author Order : 1 of 1,N/A,2020,N/A,Q2 as Journal,ADYA HERMAWATI,5977530,Universitas Widya Gama,S2 - Manajemen
Concept of telemarketing study and its type and importance,https://www.scopus.com/record/display.uri?eid=2-s2.0-85077683428&origin=resultslist,Journal of Critical Reviews,Journal of Critical Reviews,Author Order : 1 of 1,N/A,2019,N/A,Q3 as Journal,ADYA HERMAWATI,5977530,Universitas Widya Gama,S2 - Manajemen
"Performance maximization strategy of micro, small & medium enterprises through the implementation of quality of work life and job involvement",https://www.scopus.com/record/display.uri?eid=2-s2.0-85076609450&origin=resultslist,Journal of Advanced Research in Dynamical and Control Systems,Journal of Advanced Research in Dynamical and Control Systems,Author Order : 1 of 1,N/A,2019,N/A,Q4 as Journal,ADYA HERMAWATI,5977530,Universitas Widya Gama,S2 - Manajemen
"Importance performance analysis on expectancy and reality levels of tourists and employees of the micro, small & medium enterprises of tourism sector",https://www.scopus.com/record/display.uri?eid=2-s2.0-85075567774&origin=resultslist,Journal of Advanced Research in Dynamical and Control Systems,Journal of Advanced Research in Dynamical and Control Systems,Author Order : 1 of 1,N/A,2019,N/A,Q4 as Journal,ADYA HERMAWATI,5977530,Universitas Widya Gama,S2 - Manajemen
The transglobal leadership-based strategy of MSMEs performance optimization of Malang Raya and the implementation of quality of work life,https://www.scopus.com/record/display.uri?eid=2-s2.0-85064741735&origin=resultslist,Research Journal of Textile and Apparel,Research Journal of Textile and Apparel,Author Order : 1 of 1,N/A,2019,N/A,Q3 as Journal,ADYA HERMAWATI,5977530,Universitas Widya Gama,S2 - Manajemen
"Mediation effect of quality of worklife, job involvement, and organizational citizenship behavior in relationship between transglobal leadership to employee performance",https://www.scopus.com/record/display.uri?eid=2-s2.0-85048246276&origin=resultslist,International Journal of Law and Management,International Journal of Law and Management,Author Order : 1 of 1,N/A,2017,N/A,Q3 as Journal,ADYA HERMAWATI,5977530,Universitas Widya Gama,S2 - Manajemen
"The relationship between empowerment to quality of work life, trust, satisfation, commitment and performance (case study in sharia bank in East Java, Indonesia)",https://www.scopus.com/record/display.uri?eid=2-s2.0-85006168512&origin=resultslist,International Journal of Applied Business and Economic Research,International Journal of Applied Business and Economic Research,Author Order : 1 of 1,N/A,2015,N/A,Q4 as Journal,ADYA HERMAWATI,5977530,Universitas Widya Gama,S2 - Manajemen
The effects of QWL mediation and work involvement in the effect of KT to employees' performances (A study on Islamic Bank in East Java),https://www.scopus.com/record/display.uri?eid=2-s2.0-84937719625&origin=resultslist,International Journal of Economic Research,International Journal of Economic Research,Author Order : 1 of 1,N/A,2015,N/A,Q4 as Journal,ADYA HERMAWATI,5977530,Universitas Widya Gama,S2 - Manajemen
